<?xml version="1.0" encoding="UTF-8"?>
<Company xmlns:xsi="http://www.w3.org/2001/XMLSchema-instance"
    xsi:noNamespaceSchemaLocation="Company.xsd">
    <Client Client_ID="C001" Name="John Doe">
        <Subscription Subscribtion_ID="S001" Subscription_Date="2024-01-15" Type="FIXE">
            <Invoice Invoice_ID="I001" Invoice_Date="2024-02-01" Price="100.50" Done="YES"/>
            <Invoice Invoice_ID="I002" Invoice_Date="2024-03-01" Price="75.00" Done="NO"/>
        </Subscription>
        <Subscription Subscribtion_ID="S002" Subscription_Date="2024-01-20" Type="GSM">
            <Invoice Invoice_ID="I003" Invoice_Date="2024-02-10" Price="50.00" Done="YES"/>
        </Subscription>
        <Adresse>123 Main Street, Anytown</Adresse>
    </Client>
    <Client Client_ID="C002" Name="Jane Smith">
        <Subscription Subscribtion_ID="S003" Subscription_Date="2024-02-01" Type="FO">
            <Invoice Invoice_ID="I004" Invoice_Date="2024-02-15" Price="200.00" Done="YES"/>
        </Subscription>
    </Client>
    <Client Client_ID="C003" Name="Alice Brown">
        <Subscription Subscribtion_ID="S004" Subscription_Date="2024-03-05" Type="FIXE">
            <Invoice Invoice_ID="I005" Invoice_Date="2024-03-20" Price="120.75" Done="YES"/>
        </Subscription>
        <Subscription Subscribtion_ID="S005" Subscription_Date="2024-03-10" Type="GSM">
            <Invoice Invoice_ID="I006" Invoice_Date="2024-03-25" Price="80.00" Done="NO"/>
            <Invoice Invoice_ID="I007" Invoice_Date="2024-03-30" Price="60.50" Done="YES"/>
        </Subscription>
        <Adresse>456 Oak Street, Smalltown</Adresse>
    </Client>
    <Client Client_ID="C004" Name="Bob White">
        <Subscription Subscribtion_ID="S006" Subscription_Date="2024-04-01" Type="FO">
            <Invoice Invoice_ID="I008" Invoice_Date="2024-04-15" Price="300.00" Done="YES"/>
        </Subscription>
    </Client>
    <Client Client_ID="C005" Name="Eve Black">
        <Subscription Subscribtion_ID="S007" Subscription_Date="2024-02-25" Type="GSM">
            <Invoice Invoice_ID="I009" Invoice_Date="2024-03-05" Price="45.00" Done="YES"/>
        </Subscription>
        <Adresse>789 Pine Avenue, Middletown</Adresse>
    </Client>
</Company>